,id,sentence,Dominant emotion,emoty
318,6712,"One night we were having a barbecue on the beach and I needed to 
go to my car, which was far away from the beach. It was very 
dark as there were no street lamps. I ran in the dark, very 
scared, I ran as fast as possible.",surprise,fear
319,6713,"I separated with the one I liked most. She refused all my dates 
and told me that she had dated another one. My heart seemed to 
cease beating. I was silent for some time and then I whispered 
goodbye and left without turning back.",disgust,sadness
320,6714,"When I was a teacher in an evening school, a girl raised a lot of 
questions and expressed her opinions. She, very often, took a 
stand which was different from mine and she thought that it 
was better than mine. Her opinions were helpful academically, but 
she did not take into consideration my position in public. Also 
she seemed to be very talkative and so she disgusted me.",joy,disgust
321,6715,When I learnt that I had been admitted to the university.,fear,joy
322,6716,"After the interview for admission to the university and before 
the admission list was disclosed. I was scared that I would not 
be admitted and my fear lasted for quite some time. My fear 
disappeared only after the list was disclosed.",surprise,fear
323,6717,"When I was studying in the library - preparing for a test, two 
people sitting next to me talked to each other for 20 minutes. 
There were no other seats so I could not go elsewhere and I did 
not want to interrupt them, so I could only be angry in my heart.",sadness,anger
324,6718,"I had been separated from my girlfriend for about a year. On her 
birthday I put a present in her mailbox. I had spent two days 
choosing a suitable present for her. I waited for a few days and 
there was no reply from her; at last I received a thank-you card 
in my mailbox. On the card there was only my name, the words thank-you 
and her signature. I was very sad then.",disgust,sadness
325,6719,"When I was travelling to school by bus, I went past a place 
where a sewer had been repaired. There was a bad strong smell 
which suffocated me and I wanted to leave the place immediately.",joy,disgust
326,6720,"Talkiing about the past happy hours with two friends at night in 
a camp a few months ago. We shared our feelings, notions and 
every hidden anxiety. I thought that they cared for me and I 
was very happy and satified.",fear,joy
327,6721,"I remember that my form 2 teacher was very fierce and dogmatic. 
My feet would tremble whenever I saw her but I had to face the fact that 
I had to go for her class.",sadness,fear
328,6722,"One night I could not practise my violin as my family was 
watching T.V with the lights off, so I wanted to listen to some 
tapes. It was dark so I asked my brother to bring me a torch, 
however he scolded me. I was so angry that I slammed my violin 
on the floor.",sadness,anger
329,6723,"My mother suffers from a mental illness. One night she was not 
feeling well and was sent to the hospital. I was scared that 
she would die, and all night I was very sad and did not dare to 
close my eyes.",surprise,sadness
330,6724,"At the crowded conditions of living. I always quarrel with my 
elder brother as he puts the T.V volume at a deafening level and 
I can not practise my piano lessons. Thus I feel that my home is 
disgusting.",sadness,disgust
331,6725,"I watched a football match with my old friend. The performance 
of the team was very good and the team members were full of 
spirit. The match was excellent and every time a goal was scored 
I felt excited.",sadness,joy
332,6726,"When I got the midterm exam results, the results were below 
average and were near the lowest. I was scared of the final 
exam.",surprise,fear
333,6727,"When I came back to my hostel, my bed was full of newspapers and 
dirty clothes. My room-mate asked me to wash the clothes for him 
as he had no time (this was his responsibility). The food we 
shared had been eaten up by him (I ate little).",joy,anger
334,6728,"My sister was impolite to my father when the family was having 
lunch together at a restaurant. She thought that our parents had 
been prejudiced against her, this was an extreme thought.",sadness,sadness
335,6729,"When I was giving private tutorials to my student; he would not 
concentrate and was lazy. He had not done the home work that I 
had assigned and his academic level was very low. It was a 
nuisance.",sadness,disgust
336,6730,I received a letter from a friend whom I was missing,fear,joy
337,6731,"I feared that I would not be able to hand in the book-report on 
time as I had started working very late. The book was difficult 
to read and my teacher did not accept my work as it was handed in 
late.",sadness,fear
338,6732,"My classmate always borrowed my notes and would not return it to 
me on time. When I had a test she was selfish and irresponsible 
and so delayed my studies.",joy,anger
339,6733,When I found that my coldness had hurt somebody's sincerity.,joy,sadness
340,6734,When I was studying and someone disturbed me.,joy,disgust
341,6735,"I realized that a fellow member had grown spiritually. I was the 
leader of a spiritual group and had prayed for him. He did not 
want to burn the incense but his mother forced him to do it. 
Finally his mother told him that he could discontinue if he got 
good results at school.",sadness,joy
342,6736,Looking for the toilet in a dark place.,surprise,fear
343,6737,"I gave tutorial to a student and I found that he was lazy, he did 
not pay attention to what I taught. He did some easy questions 
wrong deliberately.",sadness,anger
344,6738,I saw a lot of starving people in a T.V news report.,joy,sadness
345,6739,"Our neighbour came and gossiped, about others, with my parents.",surprise,disgust
346,6740,"When I saw the certificate results, I did not feel very happy as I 
did not realize that I had got all the credits until my 
classmates pointed it out to me. My parents and my relatives 
praised me and I realized that my results were good i.e 2A, 5B, 
2C. I felt satisfied with the results and was happy.",fear,joy
347,6741,"An hour before receiving the certificate results I was very 
frightened. When I saw others crying I felt very tense and as 
time went by my fear grew.",surprise,fear
348,6742,"My classmate used her personal relations to get a seat for a 
subject that I wanted also. I had taken the pains to help him 
apply and I did not get selected. I did not like this as he had 
not told me the facts earlier, he need not have lied to me.",sadness,anger
349,6743,"When my mother went through an operation, it was not very serious 
but I was sad and could not sleep before the operation.",disgust,sadness
350,6744,"During a recent meeting, Mr. A showed his excitement and 
overindulged in the notes delivered. Though his curiosity could 
not be blamed, his way of accquiring knowledge was an extreme 
behaviour e.g he always tried to know what I was reading and 
gained everything he could.",surprise,disgust
351,6745,When I was admitted to the Chinese universiity.,fear,joy
352,6746,An inter-college basket-ball match.,fear,fear
353,6747,Something was stolen.,sadness,anger
354,6748,When I learnt that my close friend was going to immigrate.,disgust,sadness
355,6749,When the summer holiday job was almost over.,surprise,disgust
356,6750,When I told my girlfriend a joke openly and frankly.,sadness,joy
357,6751,Once while crossing a road I was overcome with fear.,surprise,fear
358,6752,"My intimate girlfriend told me that her father was opposed to our 
relationship and had insulted my integrity.",sadness,anger
359,6753,When my studies are too demanding and I cannot cope with it.,surprise,sadness
360,6754,The behaviour of people spitting everywhere.,joy,disgust
361,6755,When I finished the work that I had planned to do - my homework.,sadness,joy
362,6756,"I was not prepared for the exam but I wanted to sleep the night 
before the exam.",surprise,fear
363,6757,Someone played a trick on me.,sadness,anger
364,6758,"When the thing that made my friends and relatives sad happened to 
them.",disgust,sadness
365,6759,"It was a narrow and dirty passage which was located near the 
market and I had to stand there to wait for people.",surprise,disgust
366,6760,"Several good friends made me a surprise visit and this made me 
happy. They are my closest friends and we had not seen each 
other for a long time.",fear,joy
367,6761,"The hero was chased by a terrible vampire in a suspense and 
horror film shown on T.V.",surprise,fear
368,6762,"I worked with several classmates on a project. I was very 
anxious about the project while my partners showed no concern 
and when we had meetings on the project my classmates did not 
pay any attention. Some of them read books while the others 
argued on irrelevant questions. The meeting would go on for two 
hours without the main theme being discussed. We wasted time and 
could not reach a compromise. My classmates avoided doing the 
work and the responsibilities, they seemed to value other 
projects more than this one.",joy,anger
369,6763,"One of my good friends had to migrate to America. Our friendship 
had developed quite well and it was a pity as our friendship would 
fade.",sadness,sadness
370,6764,"In a study group, a person always liked to argue on some 
unimportant, irrelevant and minor points. He tried to persuade 
others in an unfriendly way. He was obstinate and would not accept 
other's point of view.",sadness,disgust
371,6765,"I remember my religious experience. During a gospel camp, a few 
friends of mine decided to believe in God. The joy that I felt 
at that time was more than words can express. I blessed them and 
praised God in my heart.",fear,joy
372,6766,"My friend and I had offended our classmate unintenionally. We 
wanted to apologize to her so we decided to visit her. We knew that she 
was stubborn so we were frightened. When we rang her door bell, 
our fear was at it's climax",surprise,fear
373,6767,"My girlfriend disliked it when I played majong (a game of gambling). 
I expressed my regrets and when I went to see her she neglected my 
existance. I was very angry and left in displeasure.",sadness,anger
374,6768,"When I said good-bye to my girlfriend. I had spent two years on 
developing this relationship and it was unsuccessful, I felt very 
sad.",disgust,sadness
375,6769,"My classmate got a ""B"" for his homework while I only got a ""C"". 
When we got the results he acted as if he did not merit this 
grade. I found that his humility was hypocritical and I found it 
disgusting.",joy,disgust
376,6770,"I learnt from the newspaper that I had been accepted at the 
Chinese university of H.K. It was 7 o'clock in the morning. 
Later I told my family and relatives about it and had tea with 
them very joyfully.",fear,joy
377,6771,"I was camping in an old broken hut which had no lights. I had 
brought along a lamp which was not working very well. The door 
made strange sounds and I was sure that strange things were 
happening. The most terrifying bit was that there were many 
wardrobes in the hut and everytime that I looked in the glass of 
the wardrobe I felt that there were ""objects"" behind me. The 
whole night was spent in fear and restlessness.",surprise,fear
378,6772,"During a football match, the other team was rude and they hurt my 
team members and me. The coach was prejudiced against us and 
punished us unreasonably. Later we fought with each other and 
the match had to be cut short.",sadness,anger
379,6773,"I heard of the death of a closefriend of mine. I had gone camping 
with him shortly before his death and the whole thing seemed very 
sudden to me.",disgust,sadness
380,6774,"A group of youngsters dressed in fads talked foul language on a 
bus. They also insulted the pedestrians on the road and were 
impolite to the passengers of the bus.",joy,disgust
381,6775,"After a busy day I went back to my hostel. I closed the door and 
had a drink, then I read my favourite book on the bed. Suddenly 
I felt peace and joy.",fear,joy
382,6776,"When I went home and there was nobody, I waited till 2 A.M and 
still nobody. I was suddenly scared and anxious as this had never 
happened before. In addition my mother was very weak and I 
feared that she had met with an accident. Therefore I was anxious 
all night.",surprise,fear
383,6777,"Yesterday I read in the newspaper that a 30 year old woman had 
abused her 2 month old son and had caused his death. I was very 
angry after reading this as this is not a human act and to abuse 
so fragile a life is not a forgivable sin.",joy,anger
384,6778,"I had a schoolmate who went to the hospital as her brain was 
bleeding. She fell unconscious for three days and when I went 
to see her I saw the miserable state the family was in. Moreover 
I could not do nothing for her. I was very sad. Finally, she 
died.",disgust,sadness
385,6779,"A tiresome person held me up all day long. I was very busy then 
(I can not remember what the problem was). He continously tried 
to make me talk to him and disturbed me.",sadness,disgust
386,6780,"I was appreciated by others, especially my family members and my 
friends.",joy,joy
387,6781,"Whenever I am alone in a dark room, walk alone on the street, 
sleep alone in the room at night or see something which is only 
partly visible. This emotion was very strong when as an 8 year 
old child I saw something horrible.",surprise,fear
388,6782,"[ Whenever I put myself in other's shoes and try to make the 
person happy, comfort him or make friends and I am misunderstood 
and rejected, especially when this person is a family member or a friend.]",disgust,anger
389,6783,"There was a conflict of interest between me and a close friend of 
mine. He only thought about his own interest and not about our 
friendship. This behaviour hurt his friends. Another incident 
is when a friend isolated himself without giving any reasons.",surprise,sadness
390,6784,When I saw a lot of rubbish and animal waste on the floor.,sadness,disgust
391,6785,"When I received the letter informing that I had been accepted to 
be a Chinese university student, I was excited as I had longed 
for it.",fear,joy
392,6786,"One day when I was a little boy, my friends asked me to play 
with them outside and to catch some boys. However our parents 
did not know that we were out and when I got home it was very 
late and I feared being scolded by my parents.",surprise,fear
393,6787,"When I learnt that a friend of mine had talked about me to 
another friend and had said wrong things about my abilities and 
attitudes. I was very angry.",sadness,anger
394,6788,"About two years ago my girlfriend suggested that we separate. 
This really gave me a shock as I had never thought that she would 
say such things. The reason she gave me was that we were not 
suited for each other.",disgust,sadness
395,6789,"Once while studying for my exam I found so many complicated words 
that it disgusted me.",joy,disgust
396,6790,"[ During a certain period, I felt successful and extremely satisfied. 
When I found that any tasks or decisions that I had made were better 
than expected.]",fear,joy
397,6791,I am scared when I stroll alone on the Chung Chi college campus.,surprise,fear
398,6792,"One day, I discussed a very important question with A. A 
suddenly declared that he would not accept my position and 
thought that he himself was right. Moreover, he attacked 
strongly, not my opinion but me personally.",sadness,anger
399,6793,"When I learnt that I had failed an exam, This not only influenced 
my emotions but also other important tasks, it also made my 
record imperfect.",disgust,sadness
400,6794,"[ I would classify subjectively, a certain gesture or the way of 
talking of a person as disgusting or inacceptable.]",joy,disgust
401,6795,"I felt happy when I received the letter telling me that I had 
been admitted to the university.",fear,joy
402,6796,"During the first year in university I had bad results in both 
the terms, especially the first term. I was afraid that I would 
not be promoted to the next year and that the others would go 
ahead of me.",surprise,fear
403,6797,Once my father slapped my mother for a small quarrel.,sadness,anger
404,6798,"A few years ago my mother suffered from canccer and died within 
two years. We had not finished our studies then and could not 
bear our responsibilities as her children. My mother had tried 
her best to take care of us but she lived in pain these two 
years. Neither the doctor nor we could do anything for her as 
cancer is incurable. I was very eager to replace her in 
suffernig , even die instead of her.",surprise,sadness
405,6799,"I used to play with a group of classmates and I found out later 
that they were cheap in thought, behaviour and conduct - they 
would smoke, fight and speak foul language. I thought that they 
destroyed the image of college students.",sadness,disgust
406,6800,"One Saturday afternoon, I deliberately dressed up nicely (I had 
been in a bad mood of late). I hoped to go for a walk in the 
soft sunlight to try and uplift my spirits. When I was having 
lunch in the canteen, two of my male classmates asked me as to 
why I was dressed so nicely (they had seldom joked with me 
before). One of them said that he had a lounge suit and we would 
look very nice if we wore them together.",joy,joy
407,6801,"The exam was drawing near and I wanted to prepare for it. But I 
had a lot of other things to do so I did not have much time to prepare 
for the exams. Whenever I sat down to study I was scared that I would 
not be able to finish it.",surprise,fear
408,6802,"A female classmate was always late for meetings which were for 
the homework and not social gatherings. We were very busy and 
the deadline was close but we had to waste half an hour or an 
hour waiting for her as we could do nothing else then.",joy,anger
409,6803,"After a meeting ended we started talking about when we would 
have the next discussion ( I had many tests the coming week and 
could not have a meeting in between, I thought that they would 
understand this as they had always done). They did not 
understand my problem and thought that I should not have so many 
other activities. Their reaction made me burst into tears.",joy,sadness
410,6804,"When I was studying in the library a pair of lovers were sitting 
next to me talking in an intense and soft voice. They were 
disturbing others.",joy,disgust
411,6805,"It was the first time I met him (my boyfriend Mr.W). It was 
during the first term Summer vacations. We met each other while 
handing in our homework. He invited me have a trip with him and 
we were together till 8 P.M.",fear,joy
412,6806,"The day the results of the certificate exam came out. I went to 
school and at first I did not feel frightened. By the time I 
reached the fourth floor ( the results were being given on the 
fifth floor) I found it difficult to walk and felt that I would 
die.",surprise,fear
413,6807,"One day I had sunned my favourite shirt and was putting it back 
in the wardrobe when my younger brother snatched it from me and 
wore it. He had not had a bath and was very dirty. I scolded him 
but he answered back and locked himself up in a room. I was very 
angry so I starteed kicking on the door and abusing him loudly 
and freely.",sadness,anger
414,6808,"When I was a child I was playing on the upper deck of the bed 
with my brother. My parents slept on the lower deck. My father 
felt disgusted and beat me up. I felt very sad as my father had 
never beaten me or scolded me before.",joy,sadness
415,6809,"My boyfriend and I did not have any contact with each other during 
the Summer holidays. I met him the day of the registration and looked 
through him. In the canteen he asked me if I wanted to have a drink and 
I said no as I did not want him to do me a favour.",sadness,disgust
416,6810,"I had gone camping with my old classmates and there was a storm. 
We were in a flurry but at that time I felt the love and concern 
of my friends.",surprise,joy
417,6811,"I was on a trip to Phillipines during Summer and I was staying in 
a hotel. The room I was staying in was very silent and had very 
dim lights. The last night I felt frightened and lay awake - I 
could hear some sounds around me and dared not open my eyes - I 
waited for dawn.",surprise,fear
418,6812,"I had a very good friend in secondary school. The year after our 
graduation I prepared to celebrate her birthday and I called off 
all my appointments. I got together the other friends and we 
were ready to give the entire day to her. However this friend 
disappeared on her birthday. When I phoned another friend I 
didcovered thay she was busy, I did not call her anymore.",fear,anger
419,6813,"I am a Christian but I cannot find any meaning in life . It 
seems that I am deceiving myself but I cannot find the way out.",disgust,sadness
420,6814,"A brother from one of the Christian fellowship often phoned me 
and talked to me for half an hour or more. However there was 
nothing important in the conversation and I found the person very 
disgusting.",joy,disgust
421,6815,"When the result of the certificate exam was announced. I was 
surprised and happy as the result was better than I had 
expected.",fear,joy
422,6816,"When I was young I got lost on the street and the police found me 
after a day.",surprise,fear
423,6817,"My sister once stole my mother's money and made her very angry. 
After this my mother would beat her up for unreasonable reasons. 
One day my sister lent her book to a friend without telling my 
mother about it. When my mother learnt this she beat her up and 
even threatened her with a pair of scissors.",sadness,anger
424,6818,"My academic result was poor and I had to repeat the second year. 
I felt sad about the coming several years.",disgust,sadness
425,6819,"My mother was always fastidious about my room, bed time, etc. 
She treated us strictly and punished us physically. These 
things were intolerable.",sadness,disgust
426,6820,"I was admited to the Chinese university of Hong Kong. The day 
the results were announced I looked in the newspaper and saw my 
candidature number.",fear,joy
427,6821,"One year, when I went to a camp, I was chased by a dog. I tried 
hard and finally managed to escape from it. My torch suddenly 
went off and we talked about ghost stories and I thought that 
there were ghosts.",surprise,fear
428,6822,"When I was in F4 I played a basket-ball match against another 
school's team. One of their team members kicked a team-mate of 
mine so I kicked him back and we had a fight with each other.",sadness,anger
429,6823,"I received the mid-term exam paper of one of my major subjects 
and I found that I had failed it.",disgust,sadness
430,6824,"Once at a camp a classmate criticized me in front of others. Now 
I find that this classmate is very disgusting.",joy,disgust
431,6825,[ When my performance (homework or other work) is better than others.],sadness,joy
432,6826,"I found a problem in homework which would not get solved although 
I tried my best.",sadness,fear
433,6827,"I had a date with my girlfriend, the time and place had not been 
fixed. I asked her to phone me an hour later as it was midnight 
and I did not want to disturb her family. I waited several hours 
for her call, she did not call me that night.",surprise,anger
434,6828,"When I found that my ability to do ordinary work was worse than 
my fellow mates.",sadness,sadness
435,6829,"I made friends with a classmate whose behaviour I did not like - 
he tried to flatter other people and did not respect me.",joy,disgust
436,6830,"During my Summer vacations I planned a carnival for the community 
youth center with a few other volunteers. I was the head of the 
organizors and we spent over a month planning it. During this 
period we got to know and understood each other. We 
discovered each others potential and we planned many interesting 
things for the carnival. The day of the carnival everything was 
bright, the programmes went well and the attendants enjoyed it. 
I felt extremely excited about it.",fear,joy
437,6831,"I was a prefect at secondary school. On the sports day I told 
others that I would take down the names of the people who 
misbehaved and after some time I sat down for a brief rest. 
Suddenly the head prefect came and scolded me in front of others. 
I was very angry as there were other prefects sitting and he 
picked on me. I thought that a brief rest was not serious 
enough to be blamed.",sadness,anger
438,6832,"I had joined a youth group that observed the affairs of our 
community and so I had many opportunities to contact the 
government and the committee members of the district board (a 
local executive structure). We always tried to consult and 
discuss with them, but we found that such people did not 
understand community affairs and they even dampened our 
enthusiasm in local affairs. I did not understand why they had 
decided to work as community leaders.",joy,disgust
439,6833,"When high level results were declared, I found my candidature 
number. I was very happy as I had not expected it. As I had been 
injured before the examination and I had performed poorly.",fear,joy
440,6834,"Once, when I was ten, I could not remember why my mother was so 
angry. She fainted suddenly and I was very scared as I did not 
know what to do .",surprise,fear
441,6835,"When I got into a bus I found that my wallet had been stolen. 
It was not a great loss from the monetary point of view but I 
lost some documents - identity papers. As a result I had to 
spend several days in order to get a new one. I will always 
remember all the work I had to do and the bad treatment I 
suffered because of the bureaucratic behaviour of the civil 
servant. I had already had bad luck and they treated me like a 
criminal. At one point of time I really wanted to quarrel with 
them.",sadness,anger
