,id,sentence,Dominant emotion,emoty
442,6836,"I quarrelled with my younger sister because I had said something 
against her boyfriend. Consequently she looked through me when 
she saw me as she thought that I was trying to separate them. 
She had misunderstood me.",sadness,sadness
443,6837,"A few days back, I walked on a heap of faeces while walking on 
the road. I got goose flesh because of this.",surprise,disgust
444,6838,"After attending a song contest proposed by a band called ""Chyne"" 
we (6 of us) waited for the members of the band to greet us in 
front of the stage. We went out after a few minutes as it was 
time to close the hall. We had been waiting at the entrance hall 
for ten minutes when three of the band members came out. They 
were very excited to see us, one of them was so excited that he 
had tears in his eyes. We felt very warm and close to each 
other. They took us back into the hall and we talked freely. We 
were together for about an hour and during this time we felt 
that they were very sincere.",fear,joy
445,6839,"At noon one Sunday I received a phone call telling me that my 
mother had been knocked down by a car at the street crossing and 
that her husband should go and see her. I could not believe this 
as my father and my mother had gone out together to buy lunch 
boxes. However I immediately ran to the scene of the accident.",surprise,fear
446,6840,"The day the results of the Chinese university was announced I 
should have been very happy; however my grandmother, because of 
her prejudice and misunderstanding, started a quarrel with my 
mother. She expected me to take her side and she deliberately 
talked of my mother's wrong doings. I was very angry because - 
one my grandmother was not being reasonable and two because it 
should have been a happy day and three we had moved into a new 
house that day.",sadness,anger
447,6841,"When I was in lower six class during the Summer I joined a 
research group of the Chinese university student union. I knew 
a lot of CV students there. A year later one of them was 
travelling in mainland China and he got T.B. He died a few weeks 
after coming back to H.K. We all got together for the funeral 
and when I looked at the body for the last time I felt extremely 
sad.",disgust,sadness
448,6842,"During these Summer vacations a schoolmate who was not in my 
class went to Britain. Before he left, his classmates and some 
of us who were accquainted with him had a B.B.Q on the beach. 
When I arrived I saw that some people , who were not close 
friends of the departing person(person A), were playing mahjong. 
Some others were playing bridge and A had nothing to do, besides 
it was A who had prepared the food. Later when we wanted to talk 
and his classmates did not even have the decency to listen to him. 
They only asked him a few questions half-heartedly and then they 
talked on their own. Some of their conversation was against me and 
another classmate.",joy,disgust
449,6843,"When I received the result slip of the higher level examination 
(an university entrance exam) and saw that I had a very good 
possibility of being accepted into the university, I felt very 
excited.",fear,joy
450,6844,"One camping night, I listened to the ghost stories told by my 
classmates.",joy,fear
451,6845,"Last week I had planned to play tennis and had booked a tennis 
court. However when I arrived at the university gym the clerk 
told me that the court was being used for lessons.",sadness,anger
452,6846,"When I was ill and had to stay at the hospital for a period of 
time.",sadness,sadness
453,6847,"A few days back I was waiting for the bus at the bus stop. 
Before getting into the bus I had prepared the exact amount of 
coins to pay for the bus fair and when I got into the bus I put 
these coins into the box meant to collect the bus fair. I 
thought that I had paid and wanted to get inside. However the 
bus driver called me and asked me in an impolite way if the coins 
were stuck at the opening of the box. He had not seen me paying 
and there wasn't a stack of coins in the box. I could not 
understand this and the driver kept questioning me. He made me 
feel angry and at last i inserted a dollar coin in the box just 
to get away from him. Later I found that I had forgotten a few 
coins in my pocket and had not paid enough for the fair the first 
time. After I had entered the bus I could still hear him 
scolding me and I felt disgusted.",sadness,disgust
454,6848,"I had a dream : I had a very close friend who had several stone 
houses in the New Territories (villages) but they did not have 
much furniture. He took me to see his fields (I had never seen 
them before) and there were several inches of clear water on 
which the sunshine was reflected. I wanted to sit among the 
short green plants in the fields but was afraid of treading the 
plants to death. My friend said ""They will not die"" and I sat 
down happily and my trousers did not get wet.",surprise,joy
455,6849,"After seeing a horror film - Omen. I could not sleep at night 
even though I closed my eyes. The last scene of the film kept 
coming back to me, I seemed to hear the girls in the film 
shouting at the devil. The devil did not have any expression on 
his face and I thought that he would choose me.",surprise,fear
456,6850,"My friend often played a joke on me and sometimes I thought that 
he was a nonsensical person. Once when we went to a friend's 
house he walked in first and shut the door firmly behind him. I 
felt that he did not respect me and moreover I was his friend so 
he should not have behaved like that. I was very angry (as it is 
I was in a bad mood then).",sadness,anger
457,6851,"I suddenly found that those whom I considerered to be my good 
friends did not care for me. Although I could still be with them 
I felt unimportant. I deeply thought about the reason behind 
this so as to see who was responsible for this. Finally I made 
up my mind and decided not to expect too much from them. I was 
sad when I decided that they were no longer my good friends.",disgust,sadness
458,6852,"I had a friend who was very kind to me. I tried my best to like 
him and understand him but when I was with him I could not help 
rejecting, criticizing and blaming him. I wanted to get away 
from him as soon as possible.",sadness,disgust
459,6853,"During the exam period I studied in the library alone. A close 
friend of mine, who is also a classmate, told me that my 
application for a Japanese inter-cultural exchange programme had 
been accepted. I was not very sure as I did not know that the 
list had been declared. I ran to the board and saw that I was 
really included in the list. I was so excited that I smiled all 
day long. When I met my classmates and friends I told them the 
good news. I was so happy that I could not concentrate on my 
studies. 
",fear,joy
460,6854,"A boy phoned me at night and wanted to talk to me for 30 minutes 
outside. I thought that he would reveal what he felt and would 
question me on our relationship. I treated him as a friend and 
did not want any misunderstandings. Therefore I refused to meet 
him and told him that I would see him the coming day. I was very 
unhappy as I feared having hurt him and got him into trouble.",surprise,fear
461,6855,"We had fixed time for practice as we had to participate in the 
inter-department song contest. I arrived and found that there 
was nobody there. When I went to the canteen I found them eating 
lunch. I was so angry that I aired my greviances to one of them 
and then left.",sadness,anger
462,6856,"A friend told me that he had suffered in love and in academics. 
I shared his sadness.",disgust,sadness
463,6857,"A friend told me that a boy wanted to get to know me. At that 
time I felt disgusted and thought that it was a nonsense thing.",joy,disgust
464,6858,"That afternoon I rushed home to look at the result slip of the 
higher level as fast as possible. I opened the envelope very 
carefully and found that my results were much better than I 
had expected and thus I could enter the Chinese university. My 
diligence had paid and I was very happy.",fear,joy
465,6859,"When I was young I had gone to an old lift and played with the 
antique lift. The guy discovered me and warned me, I was very 
frightened.",surprise,fear
466,6860,"Whenever my father smokes the smell makes me feel very 
uncomfortable. He never listens to my complaints and I curse him 
furiously in my mind. I cannot solve this problem by violence 
because of traditional moral values.",joy,anger
467,6861,"My got my mathematics test's marks and could not believe that it 
was true. In the past I would have at least 80% marks. Was I 
getting weaker at studies ? This made me feel that I should not 
expect too much from going to the university.",fear,sadness
468,6862,"My friend and I worked for the community centre by holding a booth. 
One day my friend went off to another booth to play. This 
meant that I was very busy and could not maintain order. His 
behaviour disgusted me.",joy,disgust
469,6863,"One night, my boyfriend expressed his love for me in the canteen in 
the presence of my friends by giving me a present.",fear,joy
470,6864,"After listening to ghost stories with my classmates I had to back 
alone to the hostel at night. I had to walk through a long and 
quiet road and I was scared of meeting a ghost.",surprise,fear
471,6865,"I came across a girl at the school bus-stop, I had seen her 
several friends as she was a friend's friend. However my friend 
had never introduced me to her and when she got off the bus I 
smiled at her but she did not respond pretending not to have seen 
me. Her arrogant behaviour made me sick and angry.",joy,anger
472,6866,"My examination results were not satisfactory even though I had 
tried my best. Then I started wondering about my abilities for 
the major subject. However I did not know how to choose my major 
subject if I were to change it.",surprise,sadness
473,6867,"When my roommate and I had dinner together we decided as to who 
would clean the bowls. One day when I came back from school I 
found that she had not cleaned up. Since I had to cook dinner I 
cleaned them myself and felt unhappy and disgusted.",joy,disgust
474,6868,"When two female classmates and I were having lunch, we chatted and 
cracked jokes, I was very happy. However, I felt that I may have 
said something inappropriate which might cause them to have a bad 
impression of me.",joy,joy
475,6869,"I did not do well in one of the subjects last term. I was 
afraid that I would fail. My result was a grade D, though it was 
not good I still passed. I felt more comfortable then.",fear,fear
476,6870,"My friend half-teasingly called me a bad nickname. I felt 
insulted and kicked his hip in anger. I was stable later and did 
not feel angry at him. In fact I was afraid that the other 
friends who were with us would think that I was an intolerant 
person. However I could not apologize, so I pretended that 
nothing had happened and smiled when I left. My friend did not 
say anything but just watched me leave.",sadness,anger
477,6871,"Last night I did not do very well in one of the subjects. Before 
the result was announced I feared that I would fail. Finally I 
got a D and as the results of the other subjects were not all 
good I felt a little sad.",disgust,sadness
478,6872,"Whenever I spoke to a female classmate I felt disgusted. She 
said meaningless things and seemed to indicate something to me 
but I did not love/like her.",joy,disgust
479,6873,"When I received a letter from the university telling me that my 
application had been accepted.",fear,joy
480,6874,"At primary school the teacher caught me cheating during a 
dictation.",surprise,fear
481,6875,Someone spread rumours about me.,joy,anger
482,6876,"One night my father suddenly suffered from a heart attack which 
lead to breathing difficulties.",disgust,sadness
483,6877,"The curriculum of the year ! The English course was very heavy. 
I had not prepared and the teacher asked several questions 
during class. The students were not ready to answer the 
questions and the teacher was frustated.",surprise,disgust
484,6878,"I had a picnic with old classmates, we chatted and played games.",joy,joy
485,6879,"At night when I was alone at home (all the family members usually 
get together at that time) someone knocked vigorously on the 
door.",surprise,fear
486,6880,"When I saw that my bed at the hostel was a mess I guessed that 
someone else had used my daily necessities. I felt that my personal 
sanity had been affected.",joy,anger
487,6881,"During the Physics experiment session I did not understand the 
content of the experiment and did not know how to do it.",surprise,sadness
488,6882,"A man sexually aggressed a small girl in the bus but the girl did 
not dare to speak out.",joy,disgust
489,6883,"It was the first time that I gave a birthday present to my friend. 
She wrote me a letter as she is my girlfriend. The content of 
the letter was so sweet that it made me feel very happy. 
",fear,joy
490,6884,"It was a week before the higher level results were announced. I 
had tried and failed many times and this was the last time that 
I was taking the exam. I knew that if i failed again I woulld 
have to enter the society. I imagined things during this period 
- I dreamt that I had entered university and it was a nice 
experience. When I thought about the future, an unexplainable 
fear rose in me. I feared being a worker and not having a bright 
prospect, I also feared the criticism of my relatives as my 
brother had gone to university. Whenevr I thought of this issue 
I could not eat or concentrate, and my heart beat increased.",surprise,fear
491,6885,"The surname of my brother was different from ours. He often 
grinned at home and provoked others for the pleasure of it. This 
made me angry.",sadness,anger
492,6886,"When I was in primary 6, my father died. I was very young then 
and did not know what had happened. The weeping of my relatives 
and my tears made me sad.",disgust,sadness
493,6887,"In August,1983, the long awaited ""big envelope"" (a document for 
C.U.H.K admission) arrived. It was in the afternoon and I had 
not been doing anything. When the postman, with his big bag, 
knocked on the door I knew what it was about. I hurriedly 
opened the envelope and my mood at that time is hard to describe. 
It lasted several hours and only calmed down later.",sadness,joy
494,6888,"On Christmas eve,1984, I had just finished the exams and was 
afraid as the results of one of my major subjects had been very 
unsatisfactory. I thought that I had only a 50% chance of 
passing. Even if I failed this subject I would not need to 
repeat. However I liked this subject very much and my results 
were bad because of my lazyness. If I was forced to change to a 
minor in this subject I would be very unwilling.",surprise,fear
495,6889,"In September 1984, I was forced to live with someone I did not 
like. The first week we were at loggerheads and our conversation 
was like a debate. The atmosphere was very bad. When he learnt 
that I had got 95 marks in a test he told me "" A failure, You lost 
5 marks."" I was very angry, not because my marks were lower 
than his, but because I could not tolerate his pride. I did not 
show my discontentment and carried on doing my work.",sadness,anger
496,6890,"This issue worried me rather than saddening me. In mid September 
I went to Guanggho alone. I was looking for an accomodation in 
the evening and after having walked 2 or 3 miles I still could not 
find anything. What could I do? I was not worried about 
sleeping on the streets but because of some procedural problems. 
I finally found a place to sleep at 8 o'clock.",surprise,fear
497,6891,"My roommate liked to listen to some meaningless songs which had 
melody but had no content. We lived together so when he played 
the recorder I was forced to listen to them. I could not tell 
him that I did not like to listen to the songs, as I had no right 
to disturb the freedom of others. So I would find a pretext to 
leave the room and go somewhere else.",sadness,anger
498,6892,I received a letter from a distant friend.,fear,joy
499,6893,"My parents were out and I was the eldest at home. At midnight a 
male stranger phoned us and spoke to me in a rough language. I 
hung up and heard someone walking outside our door.",surprise,fear
500,6894,"I was at home and I heard a loud sound of spitting outside the 
door. I thought that one of my family members would step on the spit 
and bring the germs in the house.",surprise,fear
